{
  "schemaVersion": "0.1",
  "id": "CONTEXT-IMPLEMENTATION",
  "version": "1.0.0",
  "title": "Implementation agent context",
  "role": "implementer",
  "allowedKinds": ["instruction", "objective", "requirement", "constraint", "decision", "architecture", "artifact_reference", "finding", "learning", "tool_contract", "secret_reference", "external_fact", "assumption"],
  "requiredKinds": ["objective", "requirement", "constraint", "tool_contract"],
  "allowedSources": ["organization_policy", "project_policy", "user_instruction", "canonical_state", "governed_contract", "verified_evidence", "external_source", "liaison_summary", "assumption"],
  "maxSensitivity": "secret",
  "maxItems": 40,
  "maxBytes": 32768,
  "kindPriority": ["instruction", "objective", "requirement", "constraint", "decision", "architecture", "finding", "learning", "artifact_reference", "tool_contract", "secret_reference", "external_fact", "assumption"],
  "toolAllowlist": ["filesystem.read", "filesystem.write", "tests.run"],
  "networkAllowlist": []
}
